{
    "form_name": "",
    "form_names": [],
    "form_order": 1,
    "id": 41,
    "is_battle_only": false,
    "is_default": true,
    "is_mega": false,
    "name": "zubat",
    "names": [],
    "order": 57,
    "pokemon": {
        "name": "zubat",
        "url": "http://localhost/api/v2/pokemon/41/"
    },
    "sprites": {
        "back_default": "http://localhost/media/sprites/pokemon/back/41.png",
        "back_shiny": "http://localhost/media/sprites/pokemon/back/shiny/41.png",
        "front_default": "http://localhost/media/sprites/pokemon/41.png",
        "front_shiny": "http://localhost/media/sprites/pokemon/shiny/41.png"
    },
    "version_group": {
        "name": "red-blue",
        "url": "http://localhost/api/v2/version-group/1/"
    }
}
