{
    "form_name": "",
    "form_names": [],
    "form_order": 1,
    "id": 340,
    "is_battle_only": false,
    "is_default": true,
    "is_mega": false,
    "name": "whiscash",
    "names": [],
    "order": 435,
    "pokemon": {
        "name": "whiscash",
        "url": "http://localhost/api/v2/pokemon/340/"
    },
    "sprites": {
        "back_default": "http://localhost/media/sprites/pokemon/back/340.png",
        "back_shiny": "http://localhost/media/sprites/pokemon/back/shiny/340.png",
        "front_default": "http://localhost/media/sprites/pokemon/340.png",
        "front_shiny": "http://localhost/media/sprites/pokemon/shiny/340.png"
    },
    "version_group": {
        "name": "ruby-sapphire",
        "url": "http://localhost/api/v2/version-group/5/"
    }
}
