{
    "form_name": "blade",
    "form_names": [
        {
            "language": {
                "name": "en",
                "url": "http://localhost/api/v2/language/9/"
            },
            "name": "Blade Forme"
        },
        {
            "language": {
                "name": "it",
                "url": "http://localhost/api/v2/language/8/"
            },
            "name": "Forma Spada"
        },
        {
            "language": {
                "name": "es",
                "url": "http://localhost/api/v2/language/7/"
            },
            "name": "Forma Filo"
        },
        {
            "language": {
                "name": "de",
                "url": "http://localhost/api/v2/language/6/"
            },
            "name": "Klingenform"
        },
        {
            "language": {
                "name": "fr",
                "url": "http://localhost/api/v2/language/5/"
            },
            "name": "Forme Assaut"
        },
        {
            "language": {
                "name": "ko",
                "url": "http://localhost/api/v2/language/3/"
            },
            "name": "\ube14\ub808\uc774\ub4dc\ud3fc"
        },
        {
            "language": {
                "name": "ja",
                "url": "http://localhost/api/v2/language/1/"
            },
            "name": "\u30d6\u30ec\u30fc\u30c9\u30d5\u30a9\u30eb\u30e0"
        }
    ],
    "form_order": 2,
    "id": 10125,
    "is_battle_only": true,
    "is_default": true,
    "is_mega": false,
    "name": "aegislash-blade",
    "names": [
        {
            "language": {
                "name": "en",
                "url": "http://localhost/api/v2/language/9/"
            },
            "name": "Blade Aegislash"
        },
        {
            "language": {
                "name": "fr",
                "url": "http://localhost/api/v2/language/5/"
            },
            "name": "Exagide Assaut"
        }
    ],
    "order": 845,
    "pokemon": {
        "name": "aegislash-blade",
        "url": "http://localhost/api/v2/pokemon/10026/"
    },
    "sprites": {
        "back_default": null,
        "back_shiny": null,
        "front_default": "http://localhost/media/sprites/pokemon/681-blade.png",
        "front_shiny": null
    },
    "version_group": {
        "name": "x-y",
        "url": "http://localhost/api/v2/version-group/15/"
    }
}
