{
    "form_name": "p",
    "form_names": [
        {
            "language": {
                "name": "en",
                "url": "http://localhost/api/v2/language/9/"
            },
            "name": "P"
        },
        {
            "language": {
                "name": "it",
                "url": "http://localhost/api/v2/language/8/"
            },
            "name": "P"
        },
        {
            "language": {
                "name": "es",
                "url": "http://localhost/api/v2/language/7/"
            },
            "name": "P"
        },
        {
            "language": {
                "name": "de",
                "url": "http://localhost/api/v2/language/6/"
            },
            "name": "P"
        },
        {
            "language": {
                "name": "fr",
                "url": "http://localhost/api/v2/language/5/"
            },
            "name": "P"
        },
        {
            "language": {
                "name": "ko",
                "url": "http://localhost/api/v2/language/3/"
            },
            "name": "P"
        },
        {
            "language": {
                "name": "ja",
                "url": "http://localhost/api/v2/language/1/"
            },
            "name": "\uff30"
        }
    ],
    "form_order": 16,
    "id": 10015,
    "is_battle_only": false,
    "is_default": false,
    "is_mega": false,
    "name": "unown-p",
    "names": [
        {
            "language": {
                "name": "en",
                "url": "http://localhost/api/v2/language/9/"
            },
            "name": "Unown P"
        },
        {
            "language": {
                "name": "fr",
                "url": "http://localhost/api/v2/language/5/"
            },
            "name": "Zarbi P"
        }
    ],
    "order": 271,
    "pokemon": {
        "name": "unown",
        "url": "http://localhost/api/v2/pokemon/201/"
    },
    "sprites": {
        "back_default": "http://localhost/media/sprites/pokemon/back/201-p.png",
        "back_shiny": "http://localhost/media/sprites/pokemon/back/shiny/201-p.png",
        "front_default": "http://localhost/media/sprites/pokemon/201-p.png",
        "front_shiny": "http://localhost/media/sprites/pokemon/shiny/201-p.png"
    },
    "version_group": {
        "name": "gold-silver",
        "url": "http://localhost/api/v2/version-group/3/"
    }
}
