{
    "form_name": "mega",
    "form_names": [
        {
            "language": {
                "name": "en",
                "url": "http://localhost/api/v2/language/9/"
            },
            "name": "Mega Audino"
        }
    ],
    "form_order": 2,
    "id": 10171,
    "is_battle_only": true,
    "is_default": true,
    "is_mega": true,
    "name": "audino-mega",
    "names": [
        {
            "language": {
                "name": "en",
                "url": "http://localhost/api/v2/language/9/"
            },
            "name": "Mega Audino"
        }
    ],
    "order": 636,
    "pokemon": {
        "name": "audino-mega",
        "url": "http://localhost/api/v2/pokemon/10069/"
    },
    "sprites": {
        "back_default": null,
        "back_shiny": null,
        "front_default": "http://localhost/media/sprites/pokemon/10069.png",
        "front_shiny": null
    },
    "version_group": {
        "name": "omega-ruby-alpha-sapphire",
        "url": "http://localhost/api/v2/version-group/16/"
    }
}
