{
    "form_name": "",
    "form_names": [],
    "form_order": 1,
    "id": 454,
    "is_battle_only": false,
    "is_default": true,
    "is_mega": false,
    "name": "toxicroak",
    "names": [],
    "order": 567,
    "pokemon": {
        "name": "toxicroak",
        "url": "http://localhost/api/v2/pokemon/454/"
    },
    "sprites": {
        "back_default": "http://localhost/media/sprites/pokemon/back/454.png",
        "back_shiny": "http://localhost/media/sprites/pokemon/back/shiny/454.png",
        "front_default": "http://localhost/media/sprites/pokemon/454.png",
        "front_shiny": "http://localhost/media/sprites/pokemon/shiny/454.png"
    },
    "version_group": {
        "name": "diamond-pearl",
        "url": "http://localhost/api/v2/version-group/8/"
    }
}
