{
    "form_name": "",
    "form_names": [],
    "form_order": 1,
    "id": 231,
    "is_battle_only": false,
    "is_default": true,
    "is_mega": false,
    "name": "phanpy",
    "names": [],
    "order": 316,
    "pokemon": {
        "name": "phanpy",
        "url": "http://localhost/api/v2/pokemon/231/"
    },
    "sprites": {
        "back_default": "http://localhost/media/sprites/pokemon/back/231.png",
        "back_shiny": "http://localhost/media/sprites/pokemon/back/shiny/231.png",
        "front_default": "http://localhost/media/sprites/pokemon/231.png",
        "front_shiny": "http://localhost/media/sprites/pokemon/shiny/231.png"
    },
    "version_group": {
        "name": "gold-silver",
        "url": "http://localhost/api/v2/version-group/3/"
    }
}
