{
    "form_name": "",
    "form_names": [],
    "form_order": 1,
    "id": 662,
    "is_battle_only": false,
    "is_default": true,
    "is_mega": false,
    "name": "fletchinder",
    "names": [],
    "order": 783,
    "pokemon": {
        "name": "fletchinder",
        "url": "http://localhost/api/v2/pokemon/662/"
    },
    "sprites": {
        "back_default": null,
        "back_shiny": null,
        "front_default": "http://localhost/media/sprites/pokemon/662.png",
        "front_shiny": null
    },
    "version_group": {
        "name": "x-y",
        "url": "http://localhost/api/v2/version-group/15/"
    }
}
